post_link,user,author_id,author_profile,role_inferred,sentiment_agentforce,justifications,evidence_quotes,n_comments
https://www.reddit.com/r/salesforce/comments/1myh6l3/type_mismatch/,Waitin4Godot,,https://www.reddit.com/user/Waitin4Godot,user,0.0,"The comment provides technical advice about Salesforce formula functions but does not express any sentiment, praise, or critique about Salesforce or Agentforce. There is no explicit evidence of the user's relationship to Salesforce.",You can use the Text function ... | Or you can use the Ispickval function.,1
https://www.reddit.com/r/salesforce/comments/1myh6l3/type_mismatch/,semicolonshitter,,https://www.reddit.com/user/semicolonshitter,user,0.0,"The comment provides technical information about Salesforce formula functions but does not express any opinion, sentiment, or personal experience. There is no explicit evidence of the user's relationship to Salesforce. | The comment provides technical information about Salesforce formula functions but does not express any sentiment or opinion about Salesforce or Agentforce. There is no explicit evidence of the user's relationship to Salesforce.","There are 3 functions that can be used for different purpose to work with picklists in formula field. | ISPICKVAL(<Picklist_Field>, ‘Text Value To Compare’)",3
https://www.reddit.com/r/salesforce/comments/1myh6l3/type_mismatch/,[deleted],,https://www.reddit.com/user/[deleted],user,0.0,"The comment has been deleted and contains no content. There is no information to determine the user's role, sentiment, or relevance to Salesforce or Agentforce.",,1
https://www.reddit.com/r/salesforce/comments/1myh6l3/type_mismatch/,Sensitive-Bee3803,,https://www.reddit.com/user/Sensitive-Bee3803,user,0.0,"The comment discusses a technical issue related to formulas and mentions experience as an admin, but does not explicitly state being a Salesforce customer or employee. There is no clear sentiment about Salesforce or Agentforce adoption or impact. | The comment simply clarifies the user's intent regarding checking a formula. There is no explicit mention of Salesforce or Agentforce adoption, impact, or sentiment. No evidence is present to assign a more specific role.",I was working on a formula and I asked ChatGPT and it keeps telling me to change the value to text | I've been working as an admin for years and have never heard of type mismatch. | I was checking the formula I had written,2
https://www.reddit.com/r/salesforce/comments/1myh6l3/type_mismatch/,urmomisfun,,https://www.reddit.com/user/urmomisfun,user,-0.3,"The comment criticizes the use of ChatGPT for Salesforce formula help, suggesting traditional resources are superior. There is no explicit mention of the commenter being a Salesforce employee, customer, or admin. The sentiment is mildly negative toward AI tools in the Salesforce context, but not directly about Salesforce or Agentforce itself.",SteveMo knows more than ChatGPT about Salesforce formulas. | Use Google (not the AI horseshit) and you’ll find whatever help you need there from the community and documentation.,1
