post_link,user,author_id,author_profile,role_inferred,sentiment_agentforce,justifications,evidence_quotes,n_comments
https://www.reddit.com/r/salesforce/comments/1n226br/just_started_prepping_for_salesforce_admin_read/,BoogerSugarSovereign,,https://www.reddit.com/user/BoogerSugarSovereign,user,0.6,"The comment provides positive advice about preparing for the Salesforce Admin certification using Salesforce's own Trailhead resources, suggesting that these are sufficient for success. There is no explicit evidence of the user's relationship to Salesforce, so the default role is 'user'. The sentiment is positive due to the endorsement of Salesforce's free training materials.","If you follow the Beginner Admin trail on Trailhead and read every single word as you complete each trail you'll have encountered everything you need to pass the Salesforce Admin certification | If you read through 100% of that text twice you will very likely pass, though once is enough for many.",1
https://www.reddit.com/r/salesforce/comments/1n226br/just_started_prepping_for_salesforce_admin_read/,Competitive_March347,,https://www.reddit.com/user/Competitive_March347,user,0.6,"The commenter shares a resource that helped them in their Salesforce admin journey, indicating a positive experience with Salesforce learning. There is no explicit statement about being a customer or employee, so the role remains 'user'. The sentiment is positive due to the phrase 'helped me a lot'.",I have gone through this playlist it helped me a lot in admin journey.,1
https://www.reddit.com/r/salesforce/comments/1n226br/just_started_prepping_for_salesforce_admin_read/,LawzE23,,https://www.reddit.com/user/LawzE23,user,0.6,"The comment recommends resources for Salesforce Admin exam preparation, indicating a positive experience with those resources. There is no explicit mention of the user's relationship to Salesforce or Agentforce, so the role remains 'user' with low confidence. The sentiment is positive regarding the exam prep process, but not directly about Salesforce or Agentforce adoption.",Highly recommend u/radnipuk course on Udemy. | Helped me understand and pass first time. | Focus on Force for exam practice as well.,1
https://www.reddit.com/r/salesforce/comments/1n226br/just_started_prepping_for_salesforce_admin_read/,FigureFar9699,,https://www.reddit.com/user/FigureFar9699,user,0.4,"The comment is positive about Salesforce learning resources, specifically Trailhead and hands-on practice in a Salesforce dev org. There is no explicit evidence of the user's relationship to Salesforce, so the role is set to 'user' with low confidence. The sentiment is moderately positive as the user recommends Salesforce's official tools.","Trailheads and Focus on Force seem to be the most recommended combo by almost everyone I’ve seen. | hands-on practice in a Salesforce dev org helps a ton, it makes the concepts from Trailhead stick way better.",1
https://www.reddit.com/r/salesforce/comments/1n226br/just_started_prepping_for_salesforce_admin_read/,therealsugar27,,https://www.reddit.com/user/therealsugar27,user,0.2,"The comment discusses using Salesforce's Trailhead for learning, expressing some positive sentiment but also noting the need for supplemental resources. The user does not explicitly identify as a Salesforce employee, customer, or former employee, so the role is set to 'user' with low confidence. The sentiment is mildly positive due to appreciation for Trailhead, but also notes its limitations.","I love trailhead for a couple modules here and there, but for deeper cert prep I had to go with Udemy videos | There is so much good content on YouTube as well so I used that to supplement for topics I needed more help on.",1
https://www.reddit.com/r/salesforce/comments/1n226br/just_started_prepping_for_salesforce_admin_read/,MoreEspresso,,https://www.reddit.com/user/MoreEspresso,user,0.1,"The commenter critiques some Salesforce Trailhead modules as 'basically garbage' but acknowledges that the linked resources are valuable and form the basis for paid courses. The sentiment is slightly positive as they recognize the value in the official resources, though they are critical of the presentation. There is no explicit evidence of the user's role beyond general discussion.","some of the modules are basically garbage but the resources linked at the bottom is where the good stuff is stored | Essentially thats what the paid courses are, a collection of re written documentation",1
https://www.reddit.com/r/salesforce/comments/1n226br/just_started_prepping_for_salesforce_admin_read/,Strict-Stand9769,,https://www.reddit.com/user/Strict-Stand9769,user,0.1,"The comment expresses gratitude and mentions being on a similar journey with guided modules and lectures, likely referring to Salesforce admin preparation. However, there is no explicit mention of using Salesforce or being a customer, employee, or former employee. Sentiment is slightly positive due to the context of learning.","Thank you for sharing. | I am also on that journey, but have a guided modules and lectures.",1
https://www.reddit.com/r/salesforce/comments/1n226br/just_started_prepping_for_salesforce_admin_read/,Tratius,,https://www.reddit.com/user/Tratius,user,0.0,"The comment is asking general questions about learning experiences and potential pitfalls, without expressing any opinion or experience related to Salesforce or Agentforce. There is no explicit evidence of the user's role or sentiment toward Salesforce.",What part of your journey was a waste of time? What traps could we avoid that caught you? What did you discover about how you learn?,1
https://www.reddit.com/r/salesforce/comments/1n226br/just_started_prepping_for_salesforce_admin_read/,Leading-Toe-4970,,https://www.reddit.com/user/Leading-Toe-4970,user,0.0,"The comment is simply asking another user about their preparation time, with no explicit mention of personal experience, opinion, or sentiment about Salesforce or Agentforce. There is no evidence of the commenter's role or sentiment.",how much time did it take you for the preparation?,1
https://www.reddit.com/r/salesforce/comments/1n226br/just_started_prepping_for_salesforce_admin_read/,George_David_S,,https://www.reddit.com/user/George_David_S,user,0.0,"The comment simply expresses a desire to connect with another user who is also preparing for Salesforce Admin. There is no explicit mention of personal use, employment, or direct opinion about Salesforce or Agentforce.","i am in the same boat, lets connect",1
https://www.reddit.com/r/salesforce/comments/1n226br/just_started_prepping_for_salesforce_admin_read/,illuminatughty,,https://www.reddit.com/user/illuminatughty,user,0.0,The comment simply expresses solidarity with another learner and does not provide any explicit information about the user's relationship to Salesforce or Agentforce. There is no sentiment expressed about Salesforce/Agentforce adoption or impact.,Good to know that I'm not the only one who is learning admin,1
https://www.reddit.com/r/salesforce/comments/1n226br/just_started_prepping_for_salesforce_admin_read/,maestro-5838,,https://www.reddit.com/user/maestro-5838,user,0.0,"The comment is a simple question about timing and does not mention Salesforce or Agentforce directly, nor does it provide any information about the user's relationship to Salesforce. There is no sentiment expressed about Salesforce/Agentforce.",When are you taking it,1
https://www.reddit.com/r/salesforce/comments/1n226br/just_started_prepping_for_salesforce_admin_read/,DJL_techylabcapt,,https://www.reddit.com/user/DJL_techylabcapt,user,0.0,"The comment simply lists additional resources without expressing any sentiment or opinion about Salesforce or Agentforce. There is no explicit evidence of the user's relationship to Salesforce, nor is there any praise or critique of the platform.",I would add the following on your list: | 1) https://forcedigest.com | 2) https://forcewise.org,1
https://www.reddit.com/r/salesforce/comments/1n226br/just_started_prepping_for_salesforce_admin_read/,kingrocks1,,https://www.reddit.com/user/kingrocks1,user,-0.2,"The commenter questions the value of learning Salesforce admin skills due to a perceived lack of job openings, which implies mild skepticism about the current demand for Salesforce roles. There is no explicit evidence of the user's relationship to Salesforce, so the default role is 'user' with low confidence.",But why to learn now when there are hardly any openings? Just wondering,1
https://www.reddit.com/r/salesforce/comments/1n226br/just_started_prepping_for_salesforce_admin_read/,ear_tickler,,https://www.reddit.com/user/ear_tickler,user,-0.5,"The comment sarcastically implies that the Salesforce Admin trail is so tedious or overwhelming that it would be mentally exhausting to complete, which is a negative sentiment about the experience of using Salesforce's training resources. There is no explicit evidence of the user's relationship to Salesforce, so the default role is 'user' with low confidence.",You’ll also unalive yourself halfway through.,1
