post_link,user,author_id,author_profile,role_inferred,sentiment_agentforce,justifications,evidence_quotes,n_comments
https://www.reddit.com/r/salesforce/comments/1mxy02u/did_i_make_the_right_choice/,Realistic_Hornet_125,,https://www.reddit.com/user/Realistic_Hornet_125,user,0.7,"The commenter explicitly states they are a Salesforce developer with 4 years of experience, confirming their employee status. They express a positive sentiment about Salesforce, highlighting high compensation, career growth, and its value as a CRM. The advice is balanced but overall positive regarding Salesforce's impact and opportunities.","I'm a Salesforce developer with 4 years of experience. | it offers high packages and strong career growth, especially if you understand how valuable Salesforce is as one of the best CRMs out there. | you can continue working in Salesforce to gain experience and maintain income.",1
https://www.reddit.com/r/salesforce/comments/1mxy02u/did_i_make_the_right_choice/,jcarmona86,,https://www.reddit.com/user/jcarmona86,user,0.6,"The commenter encourages the original poster to continue with Salesforce, highlighting its growth opportunities and the value of Salesforce skills. There is no explicit evidence of the commenter's role, so 'user' is selected with low confidence. The sentiment is positive regarding Salesforce's impact and career prospects.","Salesforce is constantly evolving, offering growth opportunities. | Your Salesforce skills are valuable and will only grow with time. | Keep crushing it in Salesforce and learning new things.",1
https://www.reddit.com/r/salesforce/comments/1mxy02u/did_i_make_the_right_choice/,_talals_,,https://www.reddit.com/user/_talals_,user,0.368,"The comment is a brief thank you and a note about sending a private message. There is no explicit mention of Salesforce or Agentforce, nor any sentiment or opinion expressed about them. No evidence is present to assign a more specific role. | The comment is a brief thank you and does not provide any information about the user's relationship to Salesforce or their opinion on Salesforce/Agentforce. There is no explicit evidence of role or sentiment. | The commenter expresses positive feelings about working with Salesforce, stating they are enjoying it and have improved their skills. They are interested in pursuing better opportunities within the Salesforce ecosystem, indicating a positive sentiment toward Salesforce's career prospects. There is no explicit evidence of their role beyond being a user.",Hey thanks. Check your PM | Gotcha. Thanks a lot. | I don’t hate Salesforce infact I am enjoying it as I’ve gotten so much better in it.,7
https://www.reddit.com/r/salesforce/comments/1mxy02u/did_i_make_the_right_choice/,Interesting_Button60,,https://www.reddit.com/user/Interesting_Button60,user,0.35,"The comment is simply asking about the user's location and does not mention Salesforce or Agentforce. There is no evidence of the commenter's role or sentiment regarding Salesforce. | The commenter encourages the original poster to continue learning Salesforce, stating it is not a dead end and highlighting the value of employment in the Salesforce ecosystem. The sentiment is mildly positive about Salesforce's potential, but there is no explicit evidence of the commenter's own role or direct experience.",Where are you located? | But Salesforce is not a dead end. | If you want to build additional skills for dev on the side I encourage you.,2
https://www.reddit.com/r/salesforce/comments/1mxy02u/did_i_make_the_right_choice/,SignificantInsect305,,https://www.reddit.com/user/SignificantInsect305,user,0.2,The commenter expresses interest in starting a Salesforce career but does not provide any explicit praise or criticism of Salesforce or Agentforce. There is no evidence of their role beyond being a general user. The sentiment is slightly positive due to their interest in joining the Salesforce ecosystem.,I am looking for a start in Salesforce. Can we connect,1
https://www.reddit.com/r/salesforce/comments/1mxy02u/did_i_make_the_right_choice/,Jamm-Rek,,https://www.reddit.com/user/Jamm-Rek,user,0.18,"The comment suggests considering other CRMs like Zoho but does not provide any explicit opinion or experience regarding Salesforce or Agentforce. There is no evidence of the user's role or sentiment towards Salesforce. | The commenter discusses their career journey, mentioning an attempt to move away from Salesforce but ultimately combining new skills with Salesforce due to high demand. The sentiment is mildly positive, as they found a beneficial niche. There is no explicit statement of being a Salesforce employee or customer, so the role remains 'user' with low confidence. | The comment simply answers a question about the new skill learned ('Cyber risk and compliance') and does not discuss Salesforce or Agentforce adoption, impact, or sentiment. There is no explicit evidence of the user's relationship to Salesforce.","If I were you, I would expand to cover other CRMs especially Zoho which is huge in the global south. | Tried my hardest to move on from Salesforce. But as chance would have it there was actually a high demand for my new skills within Salesforce. | So I merged the two and now that’s my specialty.",4
https://www.reddit.com/r/salesforce/comments/1mxy02u/did_i_make_the_right_choice/,Exciting-Weekend-671,,https://www.reddit.com/user/Exciting-Weekend-671,user,0.0,The comment discusses the potential bias of reviews in a Salesforce community but does not provide any explicit opinion or experience regarding Salesforce or Agentforce. There is no evidence of the user's role or sentiment about Salesforce.,"This is a sales force community, so most of your reviews would be biased",1
https://www.reddit.com/r/salesforce/comments/1mxy02u/did_i_make_the_right_choice/,Sullen_And_Sordid,,https://www.reddit.com/user/Sullen_And_Sordid,user,0.0,The comment is simply asking a clarifying question about the previous user's experience and does not provide any information about the commenter's own relationship to Salesforce or their sentiment towards it. There is no explicit evidence of their role or any sentiment about Salesforce/Agentforce.,what's the new skill you learned?,1
https://www.reddit.com/r/salesforce/comments/1mxy02u/did_i_make_the_right_choice/,Leroy-McGillicuddy,,https://www.reddit.com/user/Leroy-McGillicuddy,user,-0.6,"The commenter discusses their experience with Salesforce development, stating that the current US market for Salesforce dev work is 'absolutely terrible.' They advise looking at other platforms and technologies, indicating a negative sentiment toward Salesforce's current job prospects. There is no explicit evidence that the commenter is a Salesforce employee or customer, so the role is set to 'user.'",I switched to Salesforce development work about ten years ago and had a good run. | But currently the market for Salesforce dev work in the US is absolutely terrible. | My suggestion is to take a look at other platforms and technologies and think about what will be a good match for your skill set and demand over the next ten years.,1
https://www.reddit.com/r/salesforce/comments/1mxy02u/did_i_make_the_right_choice/,Automatic_Carry4979,,https://www.reddit.com/user/Automatic_Carry4979,user,-0.7,"The commenter agrees with a negative assessment of Salesforce and its ecosystem, indicating a negative sentiment towards recent changes, which includes Agentforce. There is no explicit evidence of the user's role, so the default is 'user' with low confidence.",I agree. The ecosystem is changing a lot and not in good way!,1
https://www.reddit.com/r/salesforce/comments/1mxy02u/did_i_make_the_right_choice/,elideli,,https://www.reddit.com/user/elideli,user,-0.9,"The comment is highly critical of Salesforce and Agentforce, expressing skepticism about their strategy and innovation. The user claims Salesforce is focusing too much on Agentforce and doubts its success, while also criticizing their handling of acquisitions and offshoring jobs. There is no explicit evidence that the commenter is an employee, customer, or has any insider perspective.",Salesforce is a shitty ecosystem. | They are putting all their eggs in AgentForce and I doubt they will gain any traction. | They simply suck at innovating and all the past growth was through acquisitions.,1
