post_link,user,author_id,author_profile,role_inferred,sentiment_agentforce,justifications,evidence_quotes,n_comments
https://www.reddit.com/r/salesforce/comments/1myjlek/as_a_mid_senior_salesforce_developer_what_are_my/,Brave_Ad_4203,,https://www.reddit.com/user/Brave_Ad_4203,user,0.1,"The comment discusses Salesforce developers and their skillsets, suggesting that many focus too much on Salesforce and neglect broader CS fundamentals. The sentiment is mildly positive, as the user acknowledges the value of diverse skills including Salesforce, but also implies a limitation in focusing solely on it. There is no explicit evidence of the user's role, so default values are used.","I think most of SF developers I know are too focused on SF and start to forget the fundamental CS work. | I have worked with Tech Leads who has 20-30 years of experience and not only they know Salesforce, but also other tech stack too.",1
https://www.reddit.com/r/salesforce/comments/1myjlek/as_a_mid_senior_salesforce_developer_what_are_my/,Original-Split5085,,https://www.reddit.com/user/Original-Split5085,user,0.064,"The commenter discusses their experience working with Salesforce for over a decade, mostly on federal contracts, and expresses uncertainty about transitioning out of the Salesforce ecosystem. There is a mildly negative sentiment regarding the current state of federal contracts and the challenge of moving beyond Salesforce, but no strong praise or critique. The role is set to 'user' because there is no explicit statement of being a Salesforce employee, customer, or other defined role. | The commenter expresses a willingness to continue working with Salesforce as long as jobs are available, acknowledging that the ecosystem's growth may not last forever. The sentiment is mildly positive, reflecting acceptance and some gratitude for past opportunities, but also a realistic view of potential decline.","I've spent the last 10+ years doing SF, mostly for large consultant firms, which means mostly federal contracts, which aren't what they used to be. | I don't even know how to start with being a 'developer' outside the SF eco system. | Probably, as long as jobs are available, even if I have to take a little less money.",2
https://www.reddit.com/r/salesforce/comments/1myjlek/as_a_mid_senior_salesforce_developer_what_are_my/,bloodkn07,,https://www.reddit.com/user/bloodkn07,user,0.0,"The comment is a brief expression of gratitude and agreement, without any explicit mention of Salesforce or Agentforce adoption or impact. There is no evidence of the user's role or sentiment toward Salesforce/Agentforce.",Gold advice here. Thanks for sharing!,1
https://www.reddit.com/r/salesforce/comments/1myjlek/as_a_mid_senior_salesforce_developer_what_are_my/,moopie45,,https://www.reddit.com/user/moopie45,user,0.0,"The comment is a general message of encouragement and does not mention Salesforce, Agentforce, or any related technology. There is no evidence of the user's relationship to Salesforce, nor is there any sentiment expressed about Salesforce or Agentforce.",Hey bro just stopping by to remind you to think better about yourself. | It is easy to think you're mid sometimes. But you're unique and valuable in your own way.,1
https://www.reddit.com/r/salesforce/comments/1myjlek/as_a_mid_senior_salesforce_developer_what_are_my/,cardiologist007,,https://www.reddit.com/user/cardiologist007,user,0.0,"The comment is a brief statement indicating shared experience but provides no explicit information about Salesforce or Agentforce, nor does it clarify the user's role or sentiment. There is no evidence of direct praise or critique.",Am to in the same boat,1
https://www.reddit.com/r/salesforce/comments/1myjlek/as_a_mid_senior_salesforce_developer_what_are_my/,RelhaTech,,https://www.reddit.com/user/RelhaTech,user,0.0,"The comment is a single word ('HERESY!') and does not provide any explicit information about the user's relationship to Salesforce or Agentforce, nor does it express any sentiment about their adoption or impact. There is no evidence to assign a specific role or sentiment.",HERESY!,1
https://www.reddit.com/r/salesforce/comments/1myjlek/as_a_mid_senior_salesforce_developer_what_are_my/,BigLustyPanda,,https://www.reddit.com/user/BigLustyPanda,user,0.0,"The comment is a neutral question asking about the motivation for switching out of a Salesforce developer role. There is no explicit sentiment, opinion, or personal experience regarding Salesforce or Agentforce. No evidence of the user's role is provided.",May I ask why you want to switch out of sf developer?,1
https://www.reddit.com/r/salesforce/comments/1myjlek/as_a_mid_senior_salesforce_developer_what_are_my/,OkAd402,,https://www.reddit.com/user/OkAd402,user,0.0,"The comment discusses skill levels for Salesforce developers but does not provide explicit praise or criticism of Salesforce or Agentforce. There is no clear evidence of the user's relationship to Salesforce, so the default role is 'user' with low confidence.",If you have never done integrations and only know apex I would not class you as a mid senior | Getting into front end sounds like a reasonable choice.,1
https://www.reddit.com/r/salesforce/comments/1myjlek/as_a_mid_senior_salesforce_developer_what_are_my/,IsItPalindrome,,https://www.reddit.com/user/IsItPalindrome,user,0.0,"The comment provides generic career advice about studying DSA, system design, and Java with Spring Boot to apply for software roles. There is no explicit mention of Salesforce or Agentforce adoption, impact, or critique, nor is there any evidence of the user's relationship to Salesforce.",Study DSA + system design + Java w/spring boot for a couple of months and apply for junior-mid software roles.,1
https://www.reddit.com/r/salesforce/comments/1myjlek/as_a_mid_senior_salesforce_developer_what_are_my/,mosi_moose,,https://www.reddit.com/user/mosi_moose,user,0.0,"The comment suggests considering AppExchange partners that interface with Salesforce but does not provide any explicit praise or critique of Salesforce or Agentforce. There is no evidence of the user's relationship to Salesforce, nor is there a clear sentiment expressed about Salesforce adoption or impact.",have you considered AppExchange partners that are on different stacks but interface with Salesforce?,1
https://www.reddit.com/r/salesforce/comments/1myjlek/as_a_mid_senior_salesforce_developer_what_are_my/,Gia93,,https://www.reddit.com/user/Gia93,user,0.0,"The commenter is asking a question about the differences between Salesforce development and other developer jobs, without expressing a clear opinion or sentiment about Salesforce or Agentforce. There is no explicit evidence of their role beyond being a participant in the discussion.","Hi as someone who only worked as a sf developer and doesnt know how other developer Jobs are, what would you say are the largest gaps that a sf developer are missing? | I feel its dufficult for me to imagine how developer Jobs are that are outside salesforce",1
https://www.reddit.com/r/salesforce/comments/1myjlek/as_a_mid_senior_salesforce_developer_what_are_my/,RedDoorTom,,https://www.reddit.com/user/RedDoorTom,user,0.0,"The comment '7' is too short and provides no context or information about Salesforce or Agentforce. There is no evidence of the user's relationship to Salesforce, nor any sentiment expressed about the platform.",7,1
https://www.reddit.com/r/salesforce/comments/1myjlek/as_a_mid_senior_salesforce_developer_what_are_my/,Mettsico,,https://www.reddit.com/user/Mettsico,user,0.0,"The comment simply suggests trying ServiceNow and does not provide any explicit opinion, praise, or critique about Salesforce or Agentforce. There is no evidence of the user's relationship to Salesforce, nor is there any sentiment expressed about Salesforce adoption or impact.",Try ServiceNow,1
https://www.reddit.com/r/salesforce/comments/1myjlek/as_a_mid_senior_salesforce_developer_what_are_my/,Thick-Ask5250,,https://www.reddit.com/user/Thick-Ask5250,user,-0.167,"The comment discusses the general job market and does not mention Salesforce or Agentforce specifically. There is no explicit evidence of the user's relationship to Salesforce, nor is there any sentiment expressed about Salesforce or Agentforce adoption or impact. | The commenter discusses the niche nature of Salesforce roles compared to other IT jobs, implying that there are fewer Salesforce positions available. This suggests a mildly negative sentiment about Salesforce job market prospects, but does not provide strong praise or criticism.",the entire job market is not great at the moment | Even for your traditional software developers. Everyone is struggling right now | Salesforce is niche so you won't expect to see as many positions as other dev/IT jobs.,2
https://www.reddit.com/r/salesforce/comments/1myjlek/as_a_mid_senior_salesforce_developer_what_are_my/,XxImperador09xX,,https://www.reddit.com/user/XxImperador09xX,user,-0.2,"The commenter generalizes the job market downturn to the entire IT sector, not just Salesforce. There is a mild negative sentiment about job prospects, but it is not specifically targeted at Salesforce or Agentforce.",this is not an issue specific to sf but the entire IT market is going through a rough patch | lots of great candidates looking for few roles,1
https://www.reddit.com/r/salesforce/comments/1myjlek/as_a_mid_senior_salesforce_developer_what_are_my/,Autumn-Addict,,https://www.reddit.com/user/Autumn-Addict,user,-0.215,"The comment is a generic thank you and does not provide any explicit information about the user's relationship to Salesforce or Agentforce. There is a mildly positive sentiment inferred from the gratitude, but no direct mention of Salesforce or Agentforce adoption or impact. | The comment is a brief acknowledgment of a supportive message and does not mention Salesforce, Agentforce, or any related technology. There is no evidence of the user's relationship to Salesforce, nor any sentiment expressed about the platform. | The commenter expresses a negative outlook on staying in Salesforce, suggesting it is a 'bad idea' for long-term career prospects. There is no explicit evidence of their role, so 'user' is appropriate. The sentiment is clearly negative regarding Salesforce as a career path.","Thank you very much, this was really helpful | Thanks, I guess | So you're gonna stay working in SF?",13
https://www.reddit.com/r/salesforce/comments/1myjlek/as_a_mid_senior_salesforce_developer_what_are_my/,mrdanmarks,,https://www.reddit.com/user/mrdanmarks,user,-0.4,"The commenter expresses frustration that Salesforce development skills are not easily transferable to other tech roles, despite having built several projects using Salesforce as a backend. This reflects a negative sentiment toward the value of Salesforce experience for broader career prospects.","I don’t think the skills are that transferable. | I built a node api server, react native app and a next is website using salesforce as the back end. And still don’t think I could get a JavaScript developer job. | I may need to switch careers entirely",1
https://www.reddit.com/r/salesforce/comments/1myjlek/as_a_mid_senior_salesforce_developer_what_are_my/,mondayfig,,https://www.reddit.com/user/mondayfig,user,-0.5,"The commenter discusses the difficulty of transferring from a Salesforce-focused role to a frontend developer position, citing a significant skills and experience gap. This reflects a negative sentiment toward Salesforce's impact on career mobility and skill transferability.",I work for a company that has Salesforce and frontend and It’s almost impossible to transfer internally due to the skills/experience gap. | it is possible if you’re willing to reset to an entry level developer and in effect restart your career.,1
https://www.reddit.com/r/salesforce/comments/1myjlek/as_a_mid_senior_salesforce_developer_what_are_my/,oil_fish23,,https://www.reddit.com/user/oil_fish23,user,-0.9,"The comment strongly criticizes Salesforce as a development platform, calling it 'very, very bad' and stating that its skills are not transferable to general software engineering. There is no explicit evidence of the user's personal or professional relationship to Salesforce, so the default role is 'user'.","The Salesforce platform is a very, very bad development platform. | Apex and LWCs are low quality, sandboxed, outdated, and most of what you learn is specific to the limitations of the Salesforce platform, not general software engineering. | You will not be able to pass an entry level developer interview if you have only worked on the Salesforce platform.",1
