post_link,user,author_id,author_profile,role_inferred,sentiment_agentforce,justifications,evidence_quotes,n_comments
https://www.reddit.com/r/salesforce/comments/1mtruss/junction_objects_newbie_question/,sdry__,,https://www.reddit.com/user/sdry__,user,0.0,"The comment questions a design but does not mention Salesforce or Agentforce directly, nor does it provide any explicit evidence of the user's role or sentiment about Salesforce. There is no clear praise or critique of Salesforce/Agentforce.","That’s a strange design, what do you want to accomplish?",1
https://www.reddit.com/r/salesforce/comments/1mtruss/junction_objects_newbie_question/,Interesting_Button60,,https://www.reddit.com/user/Interesting_Button60,user,0.0,"The comment gives general advice about asking better questions in the context of Salesforce but does not express any sentiment about Salesforce or Agentforce itself. There is no explicit evidence of the user's role or direct commentary on Salesforce's adoption or impact. | The comment clarifies Salesforce's technical limitations regarding master-detail relationships on junction objects, referencing official documentation. There is no explicit praise or criticism, just factual explanation. No evidence of the user's role beyond general participation. | The comment is a lighthearted response about interpreting a previous explanation and does not discuss Salesforce or Agentforce adoption, features, or impact. There is no explicit evidence of the user's relationship to Salesforce.","Don't ask us if something is possible without telling us what business process you are trying to facilitate. | The reality is you might have started the whole journey down the wrong path x) | If that is their plan, then that is not possible: [https://help.salesforce.com/s/articleView?language=en_US&id=platform.relationships_considerations.htm&type=5]",4
https://www.reddit.com/r/salesforce/comments/1mtruss/junction_objects_newbie_question/,lexphile,,https://www.reddit.com/user/lexphile,user,0.0,The comment provides technical information about Salesforce's junction object limitations but does not indicate the user's role or sentiment about Salesforce or Agentforce. There is no explicit evidence of personal usage or employment.,You cannot create another master-detail relationship on the junction object. | It already has two M-D relationships which is the max. | You can proceed with a lookup relationship instead if it solves the use case.,1
https://www.reddit.com/r/salesforce/comments/1mtruss/junction_objects_newbie_question/,[deleted],,https://www.reddit.com/user/[deleted],user,0.0,The comment has been deleted and contains no content to analyze. There is no information about the user's relationship to Salesforce or any sentiment expressed about Salesforce or Agentforce. | The comment is deleted and contains no content to analyze. There is no information about the user's relationship to Salesforce or any sentiment expressed about Salesforce or Agentforce.,,2
https://www.reddit.com/r/salesforce/comments/1mtruss/junction_objects_newbie_question/,systemographer,,https://www.reddit.com/user/systemographer,user,0.0,"The comment clarifies technical details about Salesforce junction objects but does not express any sentiment, praise, or critique about Salesforce or Agentforce. There is no explicit evidence of the user's relationship to Salesforce.",The original comment said you can't create an additional master-detail ON the junction object (it can't be a child 3 times). | u/Interesting_Button60 's comment was that you can't create a master-detail TO a junction object (it can't be a parent).,1
