post_link,user,author_id,author_profile,role_inferred,sentiment_agentforce,justifications,evidence_quotes,n_comments
https://www.reddit.com/r/salesforce/comments/1n1i16m/connecting_customgpt_to_salesforce/,lodi98,,https://www.reddit.com/user/lodi98,user,0.7,"The commenter explicitly states 'We use Azure OpenAI' and describes their use of text generation and opportunity matching with Salesforce, indicating direct experience as a customer. The sentiment is positive, as they say 'overall it works great,' though they mention ongoing improvements.",We use Azure OpenAI. | For text generation and opportunity matching. Some apex and python middleware. | we are still improving prompts and performance but overall it works great.,1
https://www.reddit.com/r/salesforce/comments/1n1i16m/connecting_customgpt_to_salesforce/,LessRabbit9072,,https://www.reddit.com/user/LessRabbit9072,user,0.6,"The commenter describes a technical solution for integrating a custom GPT with Salesforce using invocable Apex, highlighting reusability and ease of integration. There is no explicit statement of being a Salesforce employee, customer, or other role, so 'user' is appropriate. The sentiment is positive due to the described flexibility and utility.",I made it an invocable apex that only takes the prompt and api key as inputs then outputs the generated response. | That way I can throw it into any flow and reuse it all over the place.,1
https://www.reddit.com/r/salesforce/comments/1n1i16m/connecting_customgpt_to_salesforce/,Suspicious-Nerve-487,,https://www.reddit.com/user/Suspicious-Nerve-487,user,0.3,"The comment discusses Agentforce's native capabilities and expresses a positive view of its built-in features compared to custom solutions, while also highlighting security concerns with custom builds. There is no explicit evidence of the user's relationship to Salesforce or Agentforce, so the default role is 'user'.","Agentforce + BYO LLM has this capability native. | The big concern with building something custom is the security, especially when it comes to sending org data externally.",1
https://www.reddit.com/r/salesforce/comments/1n1i16m/connecting_customgpt_to_salesforce/,gottlico,,https://www.reddit.com/user/gottlico,user,0.2,"The commenter describes creating a prompt template that interacts with Salesforce files, indicating some positive engagement with Salesforce's capabilities. However, there is no explicit statement of being a Salesforce employee, customer, or user, so the role remains 'user' with low confidence. The sentiment is slightly positive due to the constructive nature of the comment.",I created a Prompt Template that takes a Salesforce file and custom prompt as inputs to extract info from the file or generate a summary.,1
https://www.reddit.com/r/salesforce/comments/1n1i16m/connecting_customgpt_to_salesforce/,happyreddithuman,,https://www.reddit.com/user/happyreddithuman,user,0.1,"The comment discusses building middleware for authentication and mentions prompt/response handling, but does not explicitly praise or critique Salesforce or Agentforce. There is no clear evidence of the user's relationship to Salesforce, nor is there a direct sentiment about Salesforce/Agentforce adoption or impact.",Don’t give it unrestricted access. | I built an Express middleware to handle authentication and deal with the prompt/response. | Works pretty cool but hasn’t helped in the job search lol.,1
