post_link,user,author_id,author_profile,role_inferred,sentiment_agentforce,justifications,evidence_quotes,n_comments
https://www.reddit.com/r/salesforce/comments/1mtmtut/salesforce_to_s3_for_file_backup/,thisisicehand,,https://www.reddit.com/user/thisisicehand,user,0.7,"The commenter expresses strong positive sentiment about the S3 Link product on Salesforce AppExchange, describing it as 'super easy to set up' and praising the support. They clarify they are not affiliated, so there is no evidence of being an employee, customer, or insider. The sentiment is positive regarding Salesforce ecosystem adoption.","I’m a big fan of [S3 Link] | super easy to set up and great support from the devs | Not affiliated, just really like their product",1
https://www.reddit.com/r/salesforce/comments/1mtmtut/salesforce_to_s3_for_file_backup/,kapybarah,,https://www.reddit.com/user/kapybarah,user,0.3,"The commenter describes implementing a solution using Salesforce (sf) and AWS SDK, stating it was 'very straightforward on the sf end.' There is no explicit statement of being a Salesforce employee or customer, so the role remains 'user.' The sentiment is mildly positive regarding Salesforce's ease of integration.","We've implemented with an lwc as well with the sdk provided by AWS. | Very straightforward on the sf end, not sure what was done on s3 side",1
https://www.reddit.com/r/salesforce/comments/1mtmtut/salesforce_to_s3_for_file_backup/,ck-pinkfish,,https://www.reddit.com/user/ck-pinkfish,user,0.2,"The commenter provides a balanced technical critique of Salesforce's native approach to S3 integration, noting both its limitations (file size, timeouts) and suggesting better alternatives. The sentiment is slightly positive due to constructive advice and practical solutions, but not strongly so due to the mention of pain points.","The native Salesforce approach means building custom Apex classes to handle the S3 API calls, which works but puts all the logic inside Salesforce. | Our clients who go this route usually run into issues with file size limits and timeout problems on large uploads. | Better option is using a middleware platform to handle the heavy lifting.",1
https://www.reddit.com/r/salesforce/comments/1mtmtut/salesforce_to_s3_for_file_backup/,pjallefar,,https://www.reddit.com/user/pjallefar,user,0.2,"The commenter describes completing a Salesforce-related task (Salesforce to S3 backup) but does not explicitly state being a Salesforce customer, employee, or having any official relationship. The sentiment is slightly positive, as they succeeded with the help of ChatGPT, but there is no direct praise or critique of Salesforce or Agentforce.","I literally just did this last week, with 0 coding experience, by asking chatgpt all the way. | I'd be happy to answer some concrete questions if you have any.",1
https://www.reddit.com/r/salesforce/comments/1mtmtut/salesforce_to_s3_for_file_backup/,uneducatedsludge,,https://www.reddit.com/user/uneducatedsludge,user,0.16,"The commenter expresses intent to experiment with a suggested idea but does not provide any explicit feedback, praise, or critique about Salesforce or Agentforce. There is no evidence of their role or direct sentiment about Salesforce's adoption or impact. | The commenter discusses their project requirements regarding an S3 connection, but does not express a clear sentiment about Salesforce or Agentforce adoption or impact. There is no explicit evidence of their role or direct critique/praise of Salesforce. | The comment expresses appreciation for the detailed architectural advice but does not provide any explicit praise or critique of Salesforce or Agentforce. The sentiment is mildly positive, reflecting gratitude and interest, but is not specifically about Salesforce's adoption or impact.",Thanks! I’ll try and tinker with this idea and see how it goes. | given my project’s status and history an s3 connection is what I need to do. | Thank you for the detailed input! This is a lot to chew on but it sounds like a great architecture.,5
https://www.reddit.com/r/salesforce/comments/1mtmtut/salesforce_to_s3_for_file_backup/,TheCannings,,https://www.reddit.com/user/TheCannings,user,0.0,"The comment is a humorous or sarcastic reply about storing AWS credentials in a GitHub pull request, and does not discuss Salesforce or Agentforce adoption or impact. There is no explicit evidence of the commenter's role or any sentiment about Salesforce.",He’s got it stored in his github pr no probs,1
https://www.reddit.com/r/salesforce/comments/1mtmtut/salesforce_to_s3_for_file_backup/,Middle_Manager_Karen,,https://www.reddit.com/user/Middle_Manager_Karen,user,-0.2,"The comment critiques the usefulness of a Salesforce backup solution if data cannot be restored to Salesforce, implying a negative sentiment about the platform's backup/restore capabilities. There is no explicit evidence of the user's relationship to Salesforce, so the default role is 'user'.",Only half as useful if the data cannot return to saleforce in a crisis. | Look at DataImporter.io if you are trying to save money,1
